{
  "id": "example",
  "title": "EXAMPLE SCENARIO",
  "emoji": "📘",
  "startStepId": "step-1",
  "completionMessage": "Сценарий завершён!",
  "version": 1,
  "theme": {
    "background": "linear-gradient(135deg, #f5efd6 0%, #F9F3E6 100%)",
    "cardBackground": "#fffdf7",
    "accentColor": "#A67C52",
    "primaryButton": "#8B5E3C",
    "npcBubbleColor": "#f5efd6",
    "decorations": ["✨"]
  },
  "steps": {
    "step-1": {
      "title": "Начало",
      "emoji": "👋",
      "requireChoice": true,
      "npc": {
        "text": "Hello! What would you like?",
        "avatar": "🧑‍🍳"
      },
      "choices": {
        "label": "ВЫБЕРИТЕ:",
        "options": [
          { "id": "a", "emoji": "🅰️", "label": "Option A" },
          { "id": "b", "emoji": "🅱️", "label": "Option B" }
        ]
      },
      "tasks": [
        {
          "type": "fill-blank",
          "configByChoice": {
            "a": {
              "title": "Заполните пропуск:",
              "sentence": "I'd like ___ , please.",
              "options": ["coffee", "tea"],
              "correctAnswer": "coffee",
              "tip": "Подсказка для варианта A."
            },
            "b": {
              "sentence": "I'd like ___ , please.",
              "options": ["coffee", "tea"],
              "correctAnswer": "tea",
              "tip": "Подсказка для варианта B."
            }
          }
        }
      ],
      "nextByChoice": {
        "a": "step-2a",
        "b": "step-2b"
      }
    },
    "step-2a": {
      "title": "Ветка A",
      "npc": { "text": "Great choice!", "avatar": "🧑‍🍳" },
      "tasks": [
        {
          "type": "word-order",
          "config": {
            "hint": "Составьте: \"Thank you\"",
            "correctOrder": ["Thank", "you"],
            "tip": "Вежливое «спасибо»."
          }
        }
      ],
      "next": "step-final"
    },
    "step-2b": {
      "title": "Ветка B",
      "tasks": [
        {
          "type": "multiple-choice",
          "config": {
            "question": "Как сказать «спасибо»?",
            "options": ["Thanks.", "Thank you.", "Ty."],
            "correctIndex": 1,
            "tip": "\"Thank you.\" — стандартная форма."
          }
        }
      ],
      "next": "step-final"
    },
    "step-final": {
      "title": "Финал",
      "emoji": "🎉",
      "isFinal": true,
      "npc": { "text": "Have a nice day!", "avatar": "🧑‍🍳" },
      "tasks": [
        {
          "type": "matching",
          "config": {
            "title": "Соедините пары:",
            "pairs": [
              { "en": "please", "ru": "пожалуйста" },
              { "en": "thank you", "ru": "спасибо" }
            ]
          }
        }
      ],
      "next": null
    }
  }
}
